{"recordType":"nutrition-intake-event","schemaVersion":"1.0.0","eventId":"intake-001","candidateReference":"candidate-apple-001","affirmation":{"kind":"human-affirmed","affirmedBy":"synthetic-practitioner"},"amount":{"value":"182","unit":"g","basis":"consumed mass"},"foodAssertionSnapshot":{"path":"state/synthetic-snapshot.json","assertionId":"food-snapshot-apple-001","source":{"id":"synthetic-reference-table","release":"2026-08-19"},"nutrientAssertionReferences":[{"id":"nutrient-energy-001","nutrientId":"energy","source":{"id":"synthetic-reference-table","release":"2026-08-19"}}]},"mediaRetention":{"containsRawPhoto":false,"containsReceiptImage":false,"containsRawAudio":false,"containsAppearanceEmbedding":false,"containsRawWearablePayload":false}}
